{"evidence_contract_version":"1.0","from_content_hash":"179cf1dc52bc6a95413c8c27879acc610c1970f9083eefe606fb314883341bef","from_content_hash_version":1,"from_record_snapshot_hash":"6746a1da9e3e98b017535b6968ee804150f6978ebbc3799dbbb1bc2a2b39368c","migrated_at":"2026-10-02T14:05:52.445369Z","migration_id":"bdns-v1-v2-a1a31726-1180-4ebc-901d-14ef1379c930","migration_reason":"canonical_enrichment_v1_to_v2","policy_id":"bdns.enriched-metadata-publication.v2","record_id":"infocs:bdns:930369-2d5b1ed00d4474a2","schema_version":"1.0","software_git_sha":"148a9ceeb26151e31ccabb37ae1b59bd9ffba0f4","source_id":"bdns","target_normalizer_version":"2.0.0","to_content_hash":"fce50513fe0248e7b39687ff7b7809d646ca071ea5413c25ea8700ec7f29c50a","to_content_hash_version":2}
