{"evidence_contract_version":"1.0","from_content_hash":"93f07a9e37734b3cb53fc2f76048f731f18d8951132184e17c008f98660587a5","from_content_hash_version":1,"from_record_snapshot_hash":"9e46c793d4d42dbc5f09b29187b76aa76e1201106cb91f10da20a71903447d9a","migrated_at":"2026-10-02T14:05:52.445369Z","migration_id":"bdns-v1-v2-a1a31726-1180-4ebc-901d-14ef1379c930","migration_reason":"canonical_enrichment_v1_to_v2","policy_id":"bdns.enriched-metadata-publication.v2","record_id":"infocs:bdns:931736-1de4f99c4186aa96","schema_version":"1.0","software_git_sha":"148a9ceeb26151e31ccabb37ae1b59bd9ffba0f4","source_id":"bdns","target_normalizer_version":"2.0.0","to_content_hash":"83850209b9d226d1a445dc63e1800c8d973990d91acd822eb25d84d38ee3faf3","to_content_hash_version":2}
