{"evidence_contract_version":"1.0","from_content_hash":"a0f33f83476e2de0291086a51e77d8ae51d87201cca52067d2b30b31bd784f0f","from_content_hash_version":1,"from_record_snapshot_hash":"4afb5b1f4288a3a32a8966241efcbd963642f40329bb7221a096f1ce6c16dcca","migrated_at":"2026-10-02T14:05:52.445369Z","migration_id":"bdns-v1-v2-a1a31726-1180-4ebc-901d-14ef1379c930","migration_reason":"canonical_enrichment_v1_to_v2","policy_id":"bdns.enriched-metadata-publication.v2","record_id":"infocs:bdns:930256-906e3b0194543b82","schema_version":"1.0","software_git_sha":"148a9ceeb26151e31ccabb37ae1b59bd9ffba0f4","source_id":"bdns","target_normalizer_version":"2.0.0","to_content_hash":"7c4ea3760aade526ff89f8fb3b9c6a8a056217031e361110b840b05167dfca4f","to_content_hash_version":2}
