{"evidence_contract_version":"1.0","from_content_hash":"43e36c42989aaaad27c7900a0116ec44b3e4f58cdbe2990eb72aeb1f1735bdb8","from_content_hash_version":1,"from_record_snapshot_hash":"78f585a3cca659b9f90dea13d52fdfd903652ce09ae70cdb19a66cddd16bd789","migrated_at":"2026-10-02T14:05:52.445369Z","migration_id":"bdns-v1-v2-a1a31726-1180-4ebc-901d-14ef1379c930","migration_reason":"canonical_enrichment_v1_to_v2","policy_id":"bdns.enriched-metadata-publication.v2","record_id":"infocs:bdns:931706-288460737486e6eb","schema_version":"1.0","software_git_sha":"148a9ceeb26151e31ccabb37ae1b59bd9ffba0f4","source_id":"bdns","target_normalizer_version":"2.0.0","to_content_hash":"29902ca032a192036c9f8ca89c07f6152d3faee081a53a5185518c65ec4538c3","to_content_hash_version":2}
