{"evidence_contract_version":"1.0","from_content_hash":"371ca4ecff1b4ddb4b8a07949f460872ecc2945625ffb97da0aecc4646da47fe","from_content_hash_version":1,"from_record_snapshot_hash":"50220303c14e924418dcc9e50b5a0d296b82d2034947db078eea369fc39de35a","migrated_at":"2026-10-02T14:05:52.445369Z","migration_id":"bdns-v1-v2-a1a31726-1180-4ebc-901d-14ef1379c930","migration_reason":"canonical_enrichment_v1_to_v2","policy_id":"bdns.enriched-metadata-publication.v2","record_id":"infocs:bdns:932437-f7df481556880049","schema_version":"1.0","software_git_sha":"148a9ceeb26151e31ccabb37ae1b59bd9ffba0f4","source_id":"bdns","target_normalizer_version":"2.0.0","to_content_hash":"66592a43fe381f50f1530b164c9f46d8ffd84e3d1c98be822a049c35136df839","to_content_hash_version":2}
