{"evidence_contract_version":"1.0","from_content_hash":"f56397ca38aaeb25b5b8abcc5d38e2ed10cc8bdfd7a4a47e2185763355172c50","from_content_hash_version":1,"from_record_snapshot_hash":"75410ab8e8dea035610ea8791b980c0f81c02aa1e3d7ad9aeb8284c3b4703307","migrated_at":"2026-10-02T14:05:52.445369Z","migration_id":"bdns-v1-v2-a1a31726-1180-4ebc-901d-14ef1379c930","migration_reason":"canonical_enrichment_v1_to_v2","policy_id":"bdns.enriched-metadata-publication.v2","record_id":"infocs:bdns:932382-be42a7c11d03eaad","schema_version":"1.0","software_git_sha":"148a9ceeb26151e31ccabb37ae1b59bd9ffba0f4","source_id":"bdns","target_normalizer_version":"2.0.0","to_content_hash":"cfee6f3bea200fcb6c163e31faaf4a394d708638f430a288443d1dde906a90d2","to_content_hash_version":2}
