{"evidence_contract_version":"1.0","from_content_hash":"3869977a0371be1d6156ce6b049a2c0624baba3514bf18674dce7cb6a822e315","from_content_hash_version":1,"from_record_snapshot_hash":"eced40bb7499e8b23a2b953b1978e120aea0eda7054f4b76e1b4e69f57edb890","migrated_at":"2026-10-02T14:05:52.445369Z","migration_id":"bdns-v1-v2-a1a31726-1180-4ebc-901d-14ef1379c930","migration_reason":"canonical_enrichment_v1_to_v2","policy_id":"bdns.enriched-metadata-publication.v2","record_id":"infocs:bdns:930696-45a6c900d74dfaf7","schema_version":"1.0","software_git_sha":"148a9ceeb26151e31ccabb37ae1b59bd9ffba0f4","source_id":"bdns","target_normalizer_version":"2.0.0","to_content_hash":"6764f0e0d9ca3ea31659edbd30e7a9b7b15e7a7aaabe51623358e44dfa5fe96b","to_content_hash_version":2}
