{"evidence_contract_version":"1.0","from_content_hash":"7f20104e6b46e942dbe1bb63252dc62d8f19e4610d7eec74e5a6a0f7ec2c3d5b","from_content_hash_version":1,"from_record_snapshot_hash":"4bf9b3c765a36382dac9fd861dd15f3c080234b165881a960d1b44f4be16e4d7","migrated_at":"2026-10-02T14:05:52.445369Z","migration_id":"bdns-v1-v2-a1a31726-1180-4ebc-901d-14ef1379c930","migration_reason":"canonical_enrichment_v1_to_v2","policy_id":"bdns.enriched-metadata-publication.v2","record_id":"infocs:bdns:931458-4f87e551ccd14a17","schema_version":"1.0","software_git_sha":"148a9ceeb26151e31ccabb37ae1b59bd9ffba0f4","source_id":"bdns","target_normalizer_version":"2.0.0","to_content_hash":"5d7af8dd491068bcf25e51607a3686c9b3bd18705637563fe8ec3fe53fed1064","to_content_hash_version":2}
