{"evidence_contract_version":"1.0","from_content_hash":"2725deaa6f62c67ab9bfcff17ceae9076bd337658ebf4138d506ef0b2f4f0b71","from_content_hash_version":1,"from_record_snapshot_hash":"f851f109d7a1d3fc4f86f4f2b8055be04a3e03b35b25130923f7449410975c9f","migrated_at":"2026-10-02T14:05:52.445369Z","migration_id":"bdns-v1-v2-a1a31726-1180-4ebc-901d-14ef1379c930","migration_reason":"canonical_enrichment_v1_to_v2","policy_id":"bdns.enriched-metadata-publication.v2","record_id":"infocs:bdns:931852-38eb8ac31b379968","schema_version":"1.0","software_git_sha":"148a9ceeb26151e31ccabb37ae1b59bd9ffba0f4","source_id":"bdns","target_normalizer_version":"2.0.0","to_content_hash":"575e02ad69dc74835c9246727f8aa196c7fb12cef6c4bdfd2a58f03047a117c5","to_content_hash_version":2}
