{"evidence_contract_version":"1.0","from_content_hash":"6088bf3a4aee6c0e793ab4fa64a5f9731cf73aeb6be825a1c31a688852cb9901","from_content_hash_version":1,"from_record_snapshot_hash":"ed16ea883107758e33660105d73ffd35d21632b0b788f72076f217e1850766d5","migrated_at":"2026-10-02T14:05:52.445369Z","migration_id":"bdns-v1-v2-a1a31726-1180-4ebc-901d-14ef1379c930","migration_reason":"canonical_enrichment_v1_to_v2","policy_id":"bdns.enriched-metadata-publication.v2","record_id":"infocs:bdns:931361-e79fa44bd180d986","schema_version":"1.0","software_git_sha":"148a9ceeb26151e31ccabb37ae1b59bd9ffba0f4","source_id":"bdns","target_normalizer_version":"2.0.0","to_content_hash":"db5f54f4a51e7b8c2b8cdd2e2aa99a2817fe0747cf4286483a734eff9fd5d410","to_content_hash_version":2}
