{"evidence_contract_version":"1.0","from_content_hash":"44b59507481e338110fb420de3b6ddd33b13e124969536080e8883d3c8fff4db","from_content_hash_version":1,"from_record_snapshot_hash":"9895e36ebe9b3c3fe5063fafe7a6105b26b127009c033e1979ded897f20aa0c4","migrated_at":"2026-10-02T14:05:52.445369Z","migration_id":"bdns-v1-v2-a1a31726-1180-4ebc-901d-14ef1379c930","migration_reason":"canonical_enrichment_v1_to_v2","policy_id":"bdns.enriched-metadata-publication.v2","record_id":"infocs:bdns:929452-5210c7025cff0aa8","schema_version":"1.0","software_git_sha":"148a9ceeb26151e31ccabb37ae1b59bd9ffba0f4","source_id":"bdns","target_normalizer_version":"2.0.0","to_content_hash":"d74d25c9eda6b3727b3544497a0e4aaea623af4f841a02c7b1f9590059d13630","to_content_hash_version":2}
