{"evidence_contract_version":"1.0","from_content_hash":"f1ce162ccf3ba5e2dee5f314978549dca5bf5ceb20b30aee23394c899268eac6","from_content_hash_version":1,"from_record_snapshot_hash":"ec5b38add8c89d5b606a157f9c7a32b532767e863ad56a0b3671048e75e8cac2","migrated_at":"2026-10-02T14:05:52.445369Z","migration_id":"bdns-v1-v2-a1a31726-1180-4ebc-901d-14ef1379c930","migration_reason":"canonical_enrichment_v1_to_v2","policy_id":"bdns.enriched-metadata-publication.v2","record_id":"infocs:bdns:931886-cce354bb32b70ff7","schema_version":"1.0","software_git_sha":"148a9ceeb26151e31ccabb37ae1b59bd9ffba0f4","source_id":"bdns","target_normalizer_version":"2.0.0","to_content_hash":"dec73c7ab4ff7fd7ff41d35e153158e2bf84d7748abd7fadf323e9eaeecd275f","to_content_hash_version":2}
