{"evidence_contract_version":"1.0","from_content_hash":"61f5c5ee084065b89f151f7778c49354d4cdc82daf37409f2dddb579236f07e7","from_content_hash_version":1,"from_record_snapshot_hash":"99fd04834aa25a26d70b7d8e31f4d397bf1eb8c342ebbfa72172eac458cae00d","migrated_at":"2026-10-02T14:05:52.445369Z","migration_id":"bdns-v1-v2-a1a31726-1180-4ebc-901d-14ef1379c930","migration_reason":"canonical_enrichment_v1_to_v2","policy_id":"bdns.enriched-metadata-publication.v2","record_id":"infocs:bdns:932765-d0bac35da83515e8","schema_version":"1.0","software_git_sha":"148a9ceeb26151e31ccabb37ae1b59bd9ffba0f4","source_id":"bdns","target_normalizer_version":"2.0.0","to_content_hash":"b66f2a31441168c1d900f84df781fc802d15c41f7a925b4a4877669cb7e5c2c5","to_content_hash_version":2}
