{"evidence_contract_version":"1.0","from_content_hash":"2e3f9324a65d968d6babe3ddb208fcb04ad974b69d68a90c47bdfddc985cdff0","from_content_hash_version":1,"from_record_snapshot_hash":"7b09fb42069a9722fd6657967fe00ec40c5b06361255963fff1958a8e8cc7b14","migrated_at":"2026-10-02T14:05:52.445369Z","migration_id":"bdns-v1-v2-a1a31726-1180-4ebc-901d-14ef1379c930","migration_reason":"canonical_enrichment_v1_to_v2","policy_id":"bdns.enriched-metadata-publication.v2","record_id":"infocs:bdns:929511-02fc1867300f3a53","schema_version":"1.0","software_git_sha":"148a9ceeb26151e31ccabb37ae1b59bd9ffba0f4","source_id":"bdns","target_normalizer_version":"2.0.0","to_content_hash":"f7cbb5ca70b97d9f12dd13baa2f00e3832f9d4c6071d3b174371957171b7081a","to_content_hash_version":2}
