{"evidence_contract_version":"1.0","from_content_hash":"5458feabff3dc5d06cd6c066174dfd0f22457cadaa7b6eb01481700054629bc1","from_content_hash_version":1,"from_record_snapshot_hash":"254eb5d3b7fb7477e16512997de5b569192f6a9b9f7469e2835c443486d5ffa1","migrated_at":"2026-10-02T14:05:52.445369Z","migration_id":"bdns-v1-v2-a1a31726-1180-4ebc-901d-14ef1379c930","migration_reason":"canonical_enrichment_v1_to_v2","policy_id":"bdns.enriched-metadata-publication.v2","record_id":"infocs:bdns:930366-30127f80ea3d0864","schema_version":"1.0","software_git_sha":"148a9ceeb26151e31ccabb37ae1b59bd9ffba0f4","source_id":"bdns","target_normalizer_version":"2.0.0","to_content_hash":"209d36fe97c6019d26fad336c871ea05fcebe8670ebe2ff0e47993abacb7e245","to_content_hash_version":2}
