{"evidence_contract_version":"1.0","from_content_hash":"f7aeb45cbdb7d587eb36f052ca6f9facae5f1b44c96504b4c2692f59f62224e6","from_content_hash_version":1,"from_record_snapshot_hash":"4f1a3f380a51ab302fb97c32790663c2af58862b6d4b50f90c3c36517f5cd329","migrated_at":"2026-10-02T14:05:52.445369Z","migration_id":"bdns-v1-v2-a1a31726-1180-4ebc-901d-14ef1379c930","migration_reason":"canonical_enrichment_v1_to_v2","policy_id":"bdns.enriched-metadata-publication.v2","record_id":"infocs:bdns:931356-43d3903b0c402700","schema_version":"1.0","software_git_sha":"148a9ceeb26151e31ccabb37ae1b59bd9ffba0f4","source_id":"bdns","target_normalizer_version":"2.0.0","to_content_hash":"cfc95e1678fc7d2947ee70640b62fa671298d52082503f6aafc285a6b2582295","to_content_hash_version":2}
