{"evidence_contract_version":"1.0","from_content_hash":"48780c3eefa388717649c0b6f10255ce53df70e1d43fb8bf32b3591eb64e41fc","from_content_hash_version":1,"from_record_snapshot_hash":"1f84961cb6d57d1ed01538c16279e2e02e4c93e83c6f4addb91837b80380c678","migrated_at":"2026-10-02T14:05:52.445369Z","migration_id":"bdns-v1-v2-a1a31726-1180-4ebc-901d-14ef1379c930","migration_reason":"canonical_enrichment_v1_to_v2","policy_id":"bdns.enriched-metadata-publication.v2","record_id":"infocs:bdns:932768-3bc9ee61a13bc9a4","schema_version":"1.0","software_git_sha":"148a9ceeb26151e31ccabb37ae1b59bd9ffba0f4","source_id":"bdns","target_normalizer_version":"2.0.0","to_content_hash":"8f115c3ddedacc64e3e09d65eeceb6d52ebcc4d5308150d428004763e3b6e47e","to_content_hash_version":2}
