{"evidence_contract_version":"1.0","from_content_hash":"cf8d9255fbe98a7773bc2e7117fcef32ea0c3b2fe1cc54932d6661ed861ac077","from_content_hash_version":1,"from_record_snapshot_hash":"f1bef4d5fa79cc2c619ad9e30b78b916b52269447ed4a9936c2aa4ca72f2aa7d","migrated_at":"2026-10-02T14:05:52.445369Z","migration_id":"bdns-v1-v2-a1a31726-1180-4ebc-901d-14ef1379c930","migration_reason":"canonical_enrichment_v1_to_v2","policy_id":"bdns.enriched-metadata-publication.v2","record_id":"infocs:bdns:931870-778bb1cee3a25e76","schema_version":"1.0","software_git_sha":"148a9ceeb26151e31ccabb37ae1b59bd9ffba0f4","source_id":"bdns","target_normalizer_version":"2.0.0","to_content_hash":"87f4308aca7bbaf588863d7d357533a58eaf46dd5f75f8d4eedcba0910022171","to_content_hash_version":2}
