{"evidence_contract_version":"1.0","from_content_hash":"fc2674f7f92c722f06ff8637e16ee10811f765f2eb9ec8a6cc9c671cda7321a9","from_content_hash_version":1,"from_record_snapshot_hash":"98ea0510d19fa9c6bf9fdec81bb387181964bddd5c1a037ce5907b027fcf0654","migrated_at":"2026-10-02T14:05:52.445369Z","migration_id":"bdns-v1-v2-a1a31726-1180-4ebc-901d-14ef1379c930","migration_reason":"canonical_enrichment_v1_to_v2","policy_id":"bdns.enriched-metadata-publication.v2","record_id":"infocs:bdns:930451-909808b80bf49560","schema_version":"1.0","software_git_sha":"148a9ceeb26151e31ccabb37ae1b59bd9ffba0f4","source_id":"bdns","target_normalizer_version":"2.0.0","to_content_hash":"25ac1aa257d0139cf2fe3675af60da1b532796d8c634b1b8f8296161cd7a0a9d","to_content_hash_version":2}
