{"evidence_contract_version":"1.0","from_content_hash":"09d54a0687e772ac2fc79bbcc46be74f1e1e71455bdf7087e8d027fffadde4d8","from_content_hash_version":1,"from_record_snapshot_hash":"ea75fb3bcccd746b9d2ee08a32605359a50d695721e6e4ae6fce760262e8383f","migrated_at":"2026-10-02T14:05:52.445369Z","migration_id":"bdns-v1-v2-a1a31726-1180-4ebc-901d-14ef1379c930","migration_reason":"canonical_enrichment_v1_to_v2","policy_id":"bdns.enriched-metadata-publication.v2","record_id":"infocs:bdns:931762-a49017f0d2d51a54","schema_version":"1.0","software_git_sha":"148a9ceeb26151e31ccabb37ae1b59bd9ffba0f4","source_id":"bdns","target_normalizer_version":"2.0.0","to_content_hash":"c72eb9f953c2dc9dc944ef477a443151a84eb442d852e8b125a84a9aec51a460","to_content_hash_version":2}
