{"evidence_contract_version":"1.0","from_content_hash":"5f85983a89a4d838c92754132eb53c50aadebab105dc49f31e273571efd5bd77","from_content_hash_version":1,"from_record_snapshot_hash":"0e002d38a2f394e92eeaec8a1f79b2d83c96b0013e8e34cb550b2d28dbda59cc","migrated_at":"2026-10-02T14:05:52.445369Z","migration_id":"bdns-v1-v2-a1a31726-1180-4ebc-901d-14ef1379c930","migration_reason":"canonical_enrichment_v1_to_v2","policy_id":"bdns.enriched-metadata-publication.v2","record_id":"infocs:bdns:930226-126b86d851e48e11","schema_version":"1.0","software_git_sha":"148a9ceeb26151e31ccabb37ae1b59bd9ffba0f4","source_id":"bdns","target_normalizer_version":"2.0.0","to_content_hash":"a216a60c7357fa809732d8417ec17f70a2ae4173090463fe793148c664b478fb","to_content_hash_version":2}
