{"evidence_contract_version":"1.0","from_content_hash":"5f54903bea061459cebe21d735a3caa880adb03e8ec6ab4daef7232f3d5bf1af","from_content_hash_version":1,"from_record_snapshot_hash":"7f70715266e119bfcc0065ca733caae117dce725383d57b3df477d7846109214","migrated_at":"2026-10-02T14:05:52.445369Z","migration_id":"bdns-v1-v2-a1a31726-1180-4ebc-901d-14ef1379c930","migration_reason":"canonical_enrichment_v1_to_v2","policy_id":"bdns.enriched-metadata-publication.v2","record_id":"infocs:bdns:931162-76cf2c55ad481d23","schema_version":"1.0","software_git_sha":"148a9ceeb26151e31ccabb37ae1b59bd9ffba0f4","source_id":"bdns","target_normalizer_version":"2.0.0","to_content_hash":"f98b2bf1f14e7b7ae3aa4394849325868289d24a6d739d90312bff5362cde60c","to_content_hash_version":2}
