{"evidence_contract_version":"1.0","from_content_hash":"35d8d2e3cb2055119216448122a24f1b1f70e0bff8d271f460227e36669835cd","from_content_hash_version":1,"from_record_snapshot_hash":"3460f3bfe46885b50a909d30e4cc90fc46a7751f9562ac64c59d2f4d64343df1","migrated_at":"2026-10-02T14:05:52.445369Z","migration_id":"bdns-v1-v2-a1a31726-1180-4ebc-901d-14ef1379c930","migration_reason":"canonical_enrichment_v1_to_v2","policy_id":"bdns.enriched-metadata-publication.v2","record_id":"infocs:bdns:930166-c04e1b565bd710ce","schema_version":"1.0","software_git_sha":"148a9ceeb26151e31ccabb37ae1b59bd9ffba0f4","source_id":"bdns","target_normalizer_version":"2.0.0","to_content_hash":"8f4bdc24e7486f5f9a845872193bf9f82ad2aaf0768cc9e21294410597cc6c83","to_content_hash_version":2}
