{"evidence_contract_version":"1.0","from_content_hash":"3238a0cc7a4ddb869429e0cdcb2a99c218f09cd37078cad805100cd08bfcf91e","from_content_hash_version":1,"from_record_snapshot_hash":"4bb18550a574542f8df29d44984cbff95abde21150a07cd8b8c49fadee4e5cc5","migrated_at":"2026-10-02T14:05:52.445369Z","migration_id":"bdns-v1-v2-a1a31726-1180-4ebc-901d-14ef1379c930","migration_reason":"canonical_enrichment_v1_to_v2","policy_id":"bdns.enriched-metadata-publication.v2","record_id":"infocs:bdns:932155-a2e55a20d8b0a8a5","schema_version":"1.0","software_git_sha":"148a9ceeb26151e31ccabb37ae1b59bd9ffba0f4","source_id":"bdns","target_normalizer_version":"2.0.0","to_content_hash":"8be9c71f726c10ff542ee165e12ded328a8a9fad23c85e9c949df7ab9f765bf9","to_content_hash_version":2}
